{
  "scenario_id": "v1_20x10",
  "auction_rule": "first-price-sealed",
  "currency": "USD",
  "description": "Twenty supplier, ten lot benchmark for sealed reverse sourcing.",
  "suppliers": [
    {
      "id": "S01",
      "name": "Atlas Castings",
      "defensive_markup_pct": 0.18,
      "capacity": {
        "L1": 1500,
        "L2": 980,
        "L3": 820,
        "L4": 1100,
        "L5": 620,
        "L6": 0,
        "L7": 0,
        "L8": 0,
        "L9": 0,
        "L10": 0
      }
    },
    {
      "id": "S02",
      "name": "Beacon Assemblies",
      "defensive_markup_pct": 0.04,
      "capacity": {
        "L1": 1460,
        "L2": 930,
        "L3": 790,
        "L4": 1040,
        "L5": 590,
        "L6": 0,
        "L7": 0,
        "L8": 0,
        "L9": 0,
        "L10": 0
      }
    },
    {
      "id": "S03",
      "name": "Crestline Logistics",
      "defensive_markup_pct": 0.15,
      "capacity": {
        "L1": 1420,
        "L2": 920,
        "L3": 840,
        "L4": 1030,
        "L5": 610,
        "L6": 0,
        "L7": 0,
        "L8": 0,
        "L9": 0,
        "L10": 0
      }
    },
    {
      "id": "S04",
      "name": "Delta Metals",
      "defensive_markup_pct": 0.05,
      "capacity": {
        "L1": 1550,
        "L2": 960,
        "L3": 800,
        "L4": 1120,
        "L5": 600,
        "L6": 0,
        "L7": 0,
        "L8": 0,
        "L9": 0,
        "L10": 0
      }
    },
    {
      "id": "S05",
      "name": "Eastvale Optics",
      "defensive_markup_pct": 0.12,
      "capacity": {
        "L1": 1380,
        "L2": 900,
        "L3": 760,
        "L4": 1010,
        "L5": 580,
        "L6": 0,
        "L7": 0,
        "L8": 0,
        "L9": 0,
        "L10": 0
      }
    },
    {
      "id": "S06",
      "name": "Forgewell Packaging",
      "defensive_markup_pct": 0.07,
      "capacity": {
        "L1": 1400,
        "L2": 910,
        "L3": 770,
        "L4": 1000,
        "L5": 570,
        "L6": 0,
        "L7": 0,
        "L8": 0,
        "L9": 0,
        "L10": 0
      }
    },
    {
      "id": "S07",
      "name": "Grove Tooling",
      "defensive_markup_pct": 0.2,
      "capacity": {
        "L1": 1480,
        "L2": 940,
        "L3": 790,
        "L4": 1060,
        "L5": 590,
        "L6": 0,
        "L7": 0,
        "L8": 0,
        "L9": 0,
        "L10": 0
      }
    },
    {
      "id": "S08",
      "name": "Harbor Precision",
      "defensive_markup_pct": 0.03,
      "capacity": {
        "L1": 1440,
        "L2": 920,
        "L3": 780,
        "L4": 1050,
        "L5": 575,
        "L6": 0,
        "L7": 0,
        "L8": 0,
        "L9": 0,
        "L10": 0
      }
    },
    {
      "id": "S09",
      "name": "Inland Fasteners",
      "defensive_markup_pct": 0.1,
      "capacity": {
        "L1": 1360,
        "L2": 890,
        "L3": 760,
        "L4": 990,
        "L5": 560,
        "L6": 0,
        "L7": 0,
        "L8": 0,
        "L9": 0,
        "L10": 0
      }
    },
    {
      "id": "S10",
      "name": "Juniper Controls",
      "defensive_markup_pct": 0.06,
      "capacity": {
        "L1": 1430,
        "L2": 900,
        "L3": 770,
        "L4": 1015,
        "L5": 585,
        "L6": 0,
        "L7": 0,
        "L8": 0,
        "L9": 0,
        "L10": 0
      }
    },
    {
      "id": "S11",
      "name": "Keystone Plastics",
      "defensive_markup_pct": 0.17,
      "capacity": {
        "L1": 0,
        "L2": 0,
        "L3": 0,
        "L4": 0,
        "L5": 0,
        "L6": 1360,
        "L7": 900,
        "L8": 760,
        "L9": 1080,
        "L10": 640
      }
    },
    {
      "id": "S12",
      "name": "Lumen Cableworks",
      "defensive_markup_pct": 0.05,
      "capacity": {
        "L1": 0,
        "L2": 0,
        "L3": 0,
        "L4": 0,
        "L5": 0,
        "L6": 1320,
        "L7": 860,
        "L8": 730,
        "L9": 1020,
        "L10": 620
      }
    },
    {
      "id": "S13",
      "name": "Meridian Sensors",
      "defensive_markup_pct": 0.14,
      "capacity": {
        "L1": 0,
        "L2": 0,
        "L3": 0,
        "L4": 0,
        "L5": 0,
        "L6": 1300,
        "L7": 850,
        "L8": 760,
        "L9": 1040,
        "L10": 630
      }
    },
    {
      "id": "S14",
      "name": "Northstar Molding",
      "defensive_markup_pct": 0.06,
      "capacity": {
        "L1": 0,
        "L2": 0,
        "L3": 0,
        "L4": 0,
        "L5": 0,
        "L6": 1400,
        "L7": 880,
        "L8": 740,
        "L9": 1090,
        "L10": 610
      }
    },
    {
      "id": "S15",
      "name": "Oakfield Systems",
      "defensive_markup_pct": 0.11,
      "capacity": {
        "L1": 0,
        "L2": 0,
        "L3": 0,
        "L4": 0,
        "L5": 0,
        "L6": 1280,
        "L7": 820,
        "L8": 700,
        "L9": 990,
        "L10": 600
      }
    },
    {
      "id": "S16",
      "name": "Pinecrest Fabrication",
      "defensive_markup_pct": 0.08,
      "capacity": {
        "L1": 0,
        "L2": 0,
        "L3": 0,
        "L4": 0,
        "L5": 0,
        "L6": 1290,
        "L7": 830,
        "L8": 710,
        "L9": 980,
        "L10": 595
      }
    },
    {
      "id": "S17",
      "name": "Quarry Industrial",
      "defensive_markup_pct": 0.19,
      "capacity": {
        "L1": 0,
        "L2": 0,
        "L3": 0,
        "L4": 0,
        "L5": 0,
        "L6": 1350,
        "L7": 870,
        "L8": 720,
        "L9": 1030,
        "L10": 610
      }
    },
    {
      "id": "S18",
      "name": "Riverton Motion",
      "defensive_markup_pct": 0.04,
      "capacity": {
        "L1": 0,
        "L2": 0,
        "L3": 0,
        "L4": 0,
        "L5": 0,
        "L6": 1310,
        "L7": 850,
        "L8": 725,
        "L9": 1010,
        "L10": 600
      }
    },
    {
      "id": "S19",
      "name": "Summit Harness",
      "defensive_markup_pct": 0.09,
      "capacity": {
        "L1": 0,
        "L2": 0,
        "L3": 0,
        "L4": 0,
        "L5": 0,
        "L6": 1270,
        "L7": 815,
        "L8": 700,
        "L9": 970,
        "L10": 590
      }
    },
    {
      "id": "S20",
      "name": "Tidal Components",
      "defensive_markup_pct": 0.07,
      "capacity": {
        "L1": 0,
        "L2": 0,
        "L3": 0,
        "L4": 0,
        "L5": 0,
        "L6": 1330,
        "L7": 840,
        "L8": 720,
        "L9": 1000,
        "L10": 605
      }
    }
  ],
  "lots": [
    {
      "id": "L1",
      "name": "Stamped actuator plates",
      "demand": 1200,
      "unit": "each",
      "max_willingness_to_pay": 17.0,
      "reserve_unit_price": 14.0,
      "scoring_weights": {
        "price": 0.65,
        "lead_time_days": 0.2,
        "esg_score": 0.1,
        "quality_score": 0.05
      }
    },
    {
      "id": "L2",
      "name": "Control bay housings",
      "demand": 850,
      "unit": "each",
      "max_willingness_to_pay": 29.0,
      "reserve_unit_price": 25.0,
      "scoring_weights": {
        "price": 0.45,
        "lead_time_days": 0.2,
        "esg_score": 0.25,
        "quality_score": 0.1
      }
    },
    {
      "id": "L3",
      "name": "Shielded cable harnesses",
      "demand": 700,
      "unit": "each",
      "max_willingness_to_pay": 43.0,
      "reserve_unit_price": 38.0,
      "scoring_weights": {
        "price": 0.35,
        "lead_time_days": 0.15,
        "esg_score": 0.35,
        "quality_score": 0.15
      }
    },
    {
      "id": "L4",
      "name": "Returnable packaging trays",
      "demand": 950,
      "unit": "each",
      "max_willingness_to_pay": 14.0,
      "reserve_unit_price": 12.2,
      "scoring_weights": {
        "price": 0.75,
        "lead_time_days": 0.15,
        "quality_score": 0.1
      }
    },
    {
      "id": "L5",
      "name": "Audited drive subassemblies",
      "demand": 500,
      "unit": "each",
      "max_willingness_to_pay": 66.0,
      "reserve_unit_price": 58.0,
      "scoring_weights": {
        "price": 0.3,
        "lead_time_days": 0.15,
        "esg_score": 0.4,
        "quality_score": 0.15
      }
    },
    {
      "id": "L6",
      "name": "Machined valve bodies",
      "demand": 1100,
      "unit": "each",
      "max_willingness_to_pay": 19.0,
      "reserve_unit_price": 16.5,
      "scoring_weights": {
        "price": 0.65,
        "lead_time_days": 0.2,
        "esg_score": 0.1,
        "quality_score": 0.05
      }
    },
    {
      "id": "L7",
      "name": "Sensor enclosure kits",
      "demand": 760,
      "unit": "each",
      "max_willingness_to_pay": 34.0,
      "reserve_unit_price": 30.0,
      "scoring_weights": {
        "price": 0.45,
        "lead_time_days": 0.2,
        "esg_score": 0.25,
        "quality_score": 0.1
      }
    },
    {
      "id": "L8",
      "name": "Medical-grade harness sets",
      "demand": 640,
      "unit": "each",
      "max_willingness_to_pay": 48.0,
      "reserve_unit_price": 42.0,
      "scoring_weights": {
        "price": 0.35,
        "lead_time_days": 0.15,
        "esg_score": 0.35,
        "quality_score": 0.15
      }
    },
    {
      "id": "L9",
      "name": "Dunnage separator trays",
      "demand": 900,
      "unit": "each",
      "max_willingness_to_pay": 11.8,
      "reserve_unit_price": 10.5,
      "scoring_weights": {
        "price": 0.8,
        "lead_time_days": 0.1,
        "quality_score": 0.1
      }
    },
    {
      "id": "L10",
      "name": "Certified power modules",
      "demand": 520,
      "unit": "each",
      "max_willingness_to_pay": 78.0,
      "reserve_unit_price": 68.0,
      "scoring_weights": {
        "price": 0.3,
        "lead_time_days": 0.15,
        "esg_score": 0.4,
        "quality_score": 0.15
      }
    }
  ],
  "bids": [
    {"supplier_id": "S01", "lot_id": "L1", "unit_price": 11.9, "true_unit_cost": 10.7, "lead_time_days": 18, "esg_score": 70, "quality_score": 84},